[
    {
        "characterId": "yukichi-fukuzawa",
        "relatedCharacterId": "ranpo-edogawa",
        "relationshipFrom": ["guardian", "mentor", "partner"],
        "relationshipTo": ["ward", "protégé", "partner"],
        "status": "current",
        "description": "Fukuzawa met Ranpo when the young detective was isolated and unable to understand why he perceived the world differently from others. He gave Ranpo the confidence to embrace his extraordinary intelligence, became his guardian and partner, and later founded the Armed Detective Agency around their work together. Their bond remains one of deep trust, affection, and mutual respect."
    },
    {
        "characterId": "yukichi-fukuzawa",
        "relatedCharacterId": "akiko-yosano",
        "relationshipFrom": ["protector", "mentor"],
        "relationshipTo": ["protégé"],
        "status": "current",
        "description": "Fukuzawa helped rescue Yosano from the military's control and prevented Mori from using her ability again. By welcoming her into the newly formed Agency and accepting her despite the guilt she carried from the war, he gave her the opportunity to rebuild her life and use her power on her own terms."
    },
    {
        "characterId": "yukichi-fukuzawa",
        "relatedCharacterId": "doppo-kunikida",
        "relationshipFrom": ["mentor", "superior"],
        "relationshipTo": ["protégé", "subordinate"],
        "status": "current",
        "description": "Fukuzawa serves as Kunikida's mentor and superior within the Armed Detective Agency. Kunikida respects his judgment, follows his leadership closely, and acts as his second-in-command, while Fukuzawa trusts him with significant responsibility in the Agency's operations."
    },
    {
        "characterId": "ranpo-edogawa",
        "relatedCharacterId": "akiko-yosano",
        "relationshipFrom": ["friend", "longtime-colleague"],
        "relationshipTo": ["friend", "longtime-colleague"],
        "status": "current",
        "description": "Ranpo and Yosano are among the Agency's earliest members and have known each other since Fukuzawa and Ranpo helped free Yosano from Mori's influence. Yosano respects Ranpo as the world's greatest detective, while their long history allows them to understand and support one another during crises."
    },
    {
        "characterId": "osamu-dazai",
        "relatedCharacterId": "doppo-kunikida",
        "relationshipFrom": ["partner"],
        "relationshipTo": ["partner"],
        "status": "current",
        "description": "Dazai and Kunikida are regular partners in the Armed Detective Agency. Dazai's unpredictability and constant teasing frequently exasperate the highly organized Kunikida, but beneath their arguments they trust each other's abilities and work together effectively during dangerous investigations."
    },
    {
        "characterId": "osamu-dazai",
        "relatedCharacterId": "atsushi-nakajima",
        "relationshipFrom": ["mentor", "recruiter"],
        "relationshipTo": ["protégé"],
        "status": "current",
        "description": "Dazai found Atsushi shortly after he was expelled from the orphanage and guided him into joining the Armed Detective Agency. Although his teaching methods are often indirect and difficult to understand, Dazai repeatedly pushes Atsushi to recognize his own strength, make independent choices, and develop into a capable detective."
    },
    {
        "characterId": "atsushi-nakajima",
        "relatedCharacterId": "kyoka-izumi",
        "relationshipFrom": ["friend", "protector"],
        "relationshipTo": ["friend", "companion"],
        "status": "current",
        "description": "Atsushi helped Kyōka escape the Port Mafia and showed her that her past did not determine the life she had to lead. Because both suffered abuse and isolation before joining the Agency, they share a strong mutual understanding and frequently support one another as they learn to build safer lives."
    },
    {
        "characterId": "junichiro-tanizaki",
        "relatedCharacterId": "naomi-tanizaki",
        "relationshipFrom": ["older-sibling", "protector"],
        "relationshipTo": ["younger-sibling", "protected"],
        "status": "current",
        "description": "Jun'ichirō and Naomi are siblings who live together and share an unusually intense attachment. Naomi is openly affectionate toward her brother, while Jun'ichirō is fiercely protective of her and becomes exceptionally dangerous whenever her safety is threatened."
    },
    {
        "characterId": "naomi-tanizaki",
        "relatedCharacterId": "kikaro-haruno",
        "relationshipFrom": ["coworker", "friend"],
        "relationshipTo": ["coworker", "friend"],
        "status": "current",
        "description": "Naomi and Haruno work together as clerks for the Armed Detective Agency. They are frequently shown together during the Agency's daily operations and remain close companions when the noncombatant staff are placed in danger."
    },
    {
        "characterId": "doppo-kunikida",
        "relatedCharacterId": "katai-tayama",
        "relationshipFrom": ["childhood-friend", "former-colleague"],
        "relationshipTo": ["childhood-friend", "former-colleague"],
        "status": "current",
        "description": "Kunikida and Katai have known each other for more than ten years and share a familiar, long-standing friendship. Kunikida understands Katai's habits well enough to scold or motivate him directly, while Katai continues to provide valuable technical assistance even after leaving the Agency."
    },

    {
        "characterId": "ogai-mori",
        "relatedCharacterId": "elise",
        "relationshipFrom": ["creator", "master", "companion"],
        "relationshipTo": ["creation", "ability-manifestation", "companion"],
        "status": "current",
        "description": "Elise is the humanlike manifestation of Mori's ability, Vita Sexualis, and remains constantly at his side. Mori can configure her nature and uses her in combat, but their everyday interactions resemble those of a highly indulgent guardian and a strong-willed child who freely mocks and disobeys him."
    },
    {
        "characterId": "ogai-mori",
        "relatedCharacterId": "osamu-dazai",
        "relationshipFrom": [
            "former-guardian",
            "former-mentor",
            "former-superior",
            "political-opponent"
        ],
        "relationshipTo": [
            "former-ward",
            "former-protege",
            "former-subordinate",
            "political-opponent"
        ],
        "status": "current",
        "description": "Mori took Dazai in as a ward, made him a witness to the previous boss's death, and cultivated him as a future right-hand man in the Port Mafia. Their similarities produced an effective but deeply unhealthy partnership, and Dazai eventually left the Mafia after Oda's death. They now stand on opposing sides while continuing to understand and anticipate one another exceptionally well."
    },
    {
        "characterId": "ogai-mori",
        "relatedCharacterId": "akiko-yosano",
        "relationshipFrom": ["former-superior", "former-mentor", "abuser"],
        "relationshipTo": ["former-subordinate", "former-student", "victim"],
        "status": "current",
        "description": "During the Great War, Mori placed the young Yosano under his command and repeatedly forced her to heal dying soldiers for his Immortal Regiment strategy. His treatment left her profoundly traumatized and shaped her hatred of him. Years later, Mori still regarded her ability as strategically valuable, while Yosano remained determined never to be controlled by him again."
    },
    {
        "characterId": "ogai-mori",
        "relatedCharacterId": "yukichi-fukuzawa",
        "relationshipFrom": [
            "former-colleague",
            "rival",
            "organizational-counterpart",
            "occasional-ally"
        ],
        "relationshipTo": [
            "former-colleague",
            "rival",
            "organizational-counterpart",
            "occasional-ally"
        ],
        "status": "current",
        "description": "Mori and Fukuzawa once worked together under Sōseki Natsume and later became the leaders of two opposing Yokohama organizations. Their values and methods frequently clash, but both understand the importance of maintaining the city's balance and can cooperate when a greater threat endangers Yokohama."
    },
    {
        "characterId": "ogai-mori",
        "relatedCharacterId": "chuya-nakahara",
        "relationshipFrom": ["superior", "recruiter"],
        "relationshipTo": ["subordinate", "trusted-executive"],
        "status": "current",
        "description": "Mori recruited Chūya into the Port Mafia after the conflict involving Arahabaki and recognized both his immense power and his strong sense of responsibility. Chūya has since become one of Mori's most reliable executives, although he is willing to challenge or pressure his boss when the Mafia's interests and his own loyalties demand it."
    },
    {
        "characterId": "ogai-mori",
        "relatedCharacterId": "port-mafia-previous-boss",
        "relationshipFrom": ["physician", "successor", "assassin"],
        "relationshipTo": ["patient", "predecessor", "victim"],
        "status": "at-death",
        "description": "Mori served as the previous Port Mafia boss's physician while the old leader's violent rule destabilized Yokohama. He eventually killed the bedridden boss, presented the death as a natural succession, and took control of the organization with Dazai as his witness."
    },
    {
        "characterId": "osamu-dazai",
        "relatedCharacterId": "chuya-nakahara",
        "relationshipFrom": ["former-partner", "rival", "trusted-ally"],